{
  "schema_version": 1,
  "command_id": "project-os.onboard",
  "title": "Project OS onboarding report",
  "description": "Read canonical project state and return health, human gates, and unblocked next work without writing files.",
  "ownership": "INSTALL",
  "mode": "read-only",
  "program": "npx",
  "arguments": [
    "--yes",
    "github:sisodias/siso-project-os#v0.4.1",
    "onboard",
    ".",
    "--json"
  ],
  "cwd": ".",
  "required_capabilities": [
    "runtime.node"
  ],
  "success": {
    "exit_codes": [
      0
    ],
    "output": "json"
  }
}
